Correct_Company_Name,Error_By_OCR_Reader
"Thai QUARTZ Mining Co., Ltd","Thai QUART2 Mining Co., Ltd"
Thames Water Utilities CAYMAN Finance Limited,Thames Water Utilities 7YMAN Finance Limited
"Tesia Clearinghouse, LLC","Tesia Clearing1nouse, LLC"
The Old Malt SCOOP Inn,The Old Malt 5COOP Inn
"The OLD MILL - Troy, Inc","The O1D MI11 - Troy, Inc"
The Ora BANDA Hotel,The Ora 8ANDA Hotel
The ORANGE Chef Co,The 0RANGE Chef Co
"The PAJA Group, LLC","The PA1A Group, LLC"
TJX Deutschland Ltd. & Co. KG,7JX Deutschland Ltd. & Co. KG
The Mill LIQUORSAVE Limited,The Mill LI0UORSAVE Limited
"TEHAMA County Opportunity Center, Inc","T8AMA County Opportunity Center, Inc"
